{
  "$schema": "urn:project:theme-v1",
  "canvas": {
    "aspect": "4:3",
    "height": 768,
    "width": 1024
  },
  "colors": {
    "accent": "#34495E",
    "background": "#E8E6DF",
    "highlight": "#D35400",
    "muted": "#AAA79F",
    "surface": "#D2D0C8",
    "text": "#17202A"
  },
  "fallback": {
    "onInvalid": "safe-artbook",
    "splash": "generated-neutral"
  },
  "format": "theme-v1",
  "layout": {
    "maxVisibleGames": 6,
    "preset": "minimal",
    "regions": [
      {
        "height": 224,
        "id": "system-art",
        "kind": "system-art",
        "visible": true,
        "width": 320,
        "x": 48,
        "y": 80
      },
      {
        "height": 224,
        "id": "game-list",
        "kind": "game-list",
        "visible": true,
        "width": 576,
        "x": 400,
        "y": 80
      },
      {
        "height": 192,
        "id": "box-art",
        "kind": "box-art-placeholder",
        "visible": true,
        "width": 160,
        "x": 48,
        "y": 344
      },
      {
        "height": 152,
        "id": "screenshot",
        "kind": "screenshot-placeholder",
        "visible": true,
        "width": 272,
        "x": 232,
        "y": 344
      },
      {
        "height": 192,
        "id": "metadata",
        "kind": "metadata",
        "visible": true,
        "width": 448,
        "x": 528,
        "y": 344
      },
      {
        "height": 80,
        "id": "menu",
        "kind": "menu",
        "visible": true,
        "width": 928,
        "x": 48,
        "y": 568
      },
      {
        "height": 40,
        "id": "help",
        "kind": "help-strip",
        "visible": true,
        "width": 680,
        "x": 48,
        "y": 680
      },
      {
        "height": 32,
        "id": "clock",
        "kind": "clock",
        "visible": true,
        "width": 96,
        "x": 760,
        "y": 16
      },
      {
        "height": 32,
        "id": "battery",
        "kind": "battery",
        "visible": true,
        "width": 104,
        "x": 872,
        "y": 16
      }
    ]
  },
  "metadata": {
    "author": "Project Authors",
    "license": "MIT",
    "name": "Minimal Grid"
  },
  "resources": {
    "background": {
      "budgetBytes": 0,
      "kind": "generated",
      "ref": "flat-field"
    },
    "font": {
      "budgetBytes": 0,
      "kind": "builtin",
      "ref": "generated-sans"
    },
    "icon": {
      "budgetBytes": 0,
      "kind": "generated",
      "ref": "controller-mark"
    },
    "sound": {
      "budgetBytes": 0,
      "kind": "builtin",
      "ref": "silent"
    }
  },
  "schemaVersion": 1,
  "settings": {
    "artworkMode": "screenshot",
    "colorScheme": "minimal",
    "fontScale": 90,
    "metadataVisibility": "compact"
  }
}
